{
  "$schema": "https://json-schema.org/draft/2020-12/schema",
  "$id": "urn:oasis:names:specification:ubl:schema:json:RequestForQuotation-2",
  "description": "A document used to request a Quotation for goods and services from a Seller.",
  "type": "object",
  "properties": {
    "$jsonschema": {
      "const": "urn:oasis:names:specification:ubl:schema:json:RequestForQuotation-2",
      "description": "Identifies the JSON schema governing this instance."
    },
    "UBLExtensions": {
      "$ref": "urn:oasis:names:specification:ubl:schema:json:CommonExtensionComponents-2#/$defs/UBLExtensionsType"
    },
    "Signature": {
      "oneOf": [
        {
          "$ref": "urn:oasis:names:specification:ubl:schema:json:CommonAggregateComponents-2#/$defs/SignatureType"
        },
        {
          "type": "array",
          "items": {
            "$ref": "urn:oasis:names:specification:ubl:schema:json:CommonAggregateComponents-2#/$defs/SignatureType"
          }
        }
      ]
    },
    "UBLVersionID": {
      "$ref": "urn:oasis:names:specification:ubl:schema:json:CommonBasicComponents-2#/$defs/UBLVersionID"
    },
    "CustomizationID": {
      "$ref": "urn:oasis:names:specification:ubl:schema:json:CommonBasicComponents-2#/$defs/CustomizationID"
    },
    "ProfileID": {
      "$ref": "urn:oasis:names:specification:ubl:schema:json:CommonBasicComponents-2#/$defs/ProfileID"
    },
    "ProfileExecutionID": {
      "$ref": "urn:oasis:names:specification:ubl:schema:json:CommonBasicComponents-2#/$defs/ProfileExecutionID"
    },
    "ID": {
      "$ref": "urn:oasis:names:specification:ubl:schema:json:CommonBasicComponents-2#/$defs/ID"
    },
    "CopyIndicator": {
      "$ref": "urn:oasis:names:specification:ubl:schema:json:CommonBasicComponents-2#/$defs/CopyIndicator"
    },
    "UUID": {
      "$ref": "urn:oasis:names:specification:ubl:schema:json:CommonBasicComponents-2#/$defs/UUID"
    },
    "IssueDate": {
      "$ref": "urn:oasis:names:specification:ubl:schema:json:CommonBasicComponents-2#/$defs/IssueDate"
    },
    "IssueTime": {
      "$ref": "urn:oasis:names:specification:ubl:schema:json:CommonBasicComponents-2#/$defs/IssueTime"
    },
    "SubmissionDueDate": {
      "$ref": "urn:oasis:names:specification:ubl:schema:json:CommonBasicComponents-2#/$defs/SubmissionDueDate"
    },
    "Note": {
      "oneOf": [
        {
          "$ref": "urn:oasis:names:specification:ubl:schema:json:CommonBasicComponents-2#/$defs/Note"
        },
        {
          "type": "array",
          "items": {
            "$ref": "urn:oasis:names:specification:ubl:schema:json:CommonBasicComponents-2#/$defs/Note"
          }
        }
      ]
    },
    "PricingCurrencyCode": {
      "$ref": "urn:oasis:names:specification:ubl:schema:json:CommonBasicComponents-2#/$defs/PricingCurrencyCode"
    },
    "LineCountNumeric": {
      "$ref": "urn:oasis:names:specification:ubl:schema:json:CommonBasicComponents-2#/$defs/LineCountNumeric"
    },
    "RequestedValidityPeriod": {
      "$ref": "urn:oasis:names:specification:ubl:schema:json:CommonAggregateComponents-2#/$defs/PeriodType"
    },
    "CatalogueDocumentReference": {
      "$ref": "urn:oasis:names:specification:ubl:schema:json:CommonAggregateComponents-2#/$defs/DocumentReferenceType"
    },
    "AdditionalDocumentReference": {
      "oneOf": [
        {
          "$ref": "urn:oasis:names:specification:ubl:schema:json:CommonAggregateComponents-2#/$defs/DocumentReferenceType"
        },
        {
          "type": "array",
          "items": {
            "$ref": "urn:oasis:names:specification:ubl:schema:json:CommonAggregateComponents-2#/$defs/DocumentReferenceType"
          }
        }
      ]
    },
    "OriginatorCustomerParty": {
      "$ref": "urn:oasis:names:specification:ubl:schema:json:CommonAggregateComponents-2#/$defs/CustomerPartyType"
    },
    "BeneficiaryParty": {
      "oneOf": [
        {
          "$ref": "urn:oasis:names:specification:ubl:schema:json:CommonAggregateComponents-2#/$defs/PartyType"
        },
        {
          "type": "array",
          "items": {
            "$ref": "urn:oasis:names:specification:ubl:schema:json:CommonAggregateComponents-2#/$defs/PartyType"
          }
        }
      ]
    },
    "SellerSupplierParty": {
      "$ref": "urn:oasis:names:specification:ubl:schema:json:CommonAggregateComponents-2#/$defs/SupplierPartyType"
    },
    "BuyerCustomerParty": {
      "$ref": "urn:oasis:names:specification:ubl:schema:json:CommonAggregateComponents-2#/$defs/CustomerPartyType"
    },
    "Delivery": {
      "oneOf": [
        {
          "$ref": "urn:oasis:names:specification:ubl:schema:json:CommonAggregateComponents-2#/$defs/DeliveryType"
        },
        {
          "type": "array",
          "items": {
            "$ref": "urn:oasis:names:specification:ubl:schema:json:CommonAggregateComponents-2#/$defs/DeliveryType"
          }
        }
      ]
    },
    "DeliveryTerms": {
      "oneOf": [
        {
          "$ref": "urn:oasis:names:specification:ubl:schema:json:CommonAggregateComponents-2#/$defs/DeliveryTermsType"
        },
        {
          "type": "array",
          "items": {
            "$ref": "urn:oasis:names:specification:ubl:schema:json:CommonAggregateComponents-2#/$defs/DeliveryTermsType"
          }
        }
      ]
    },
    "DestinationCountry": {
      "$ref": "urn:oasis:names:specification:ubl:schema:json:CommonAggregateComponents-2#/$defs/CountryType"
    },
    "Contract": {
      "oneOf": [
        {
          "$ref": "urn:oasis:names:specification:ubl:schema:json:CommonAggregateComponents-2#/$defs/ContractType"
        },
        {
          "type": "array",
          "items": {
            "$ref": "urn:oasis:names:specification:ubl:schema:json:CommonAggregateComponents-2#/$defs/ContractType"
          }
        }
      ]
    },
    "RequestForQuotationLine": {
      "oneOf": [
        {
          "$ref": "urn:oasis:names:specification:ubl:schema:json:CommonAggregateComponents-2#/$defs/RequestForQuotationLineType"
        },
        {
          "type": "array",
          "items": {
            "$ref": "urn:oasis:names:specification:ubl:schema:json:CommonAggregateComponents-2#/$defs/RequestForQuotationLineType"
          },
          "minItems": 1
        }
      ]
    }
  },
  "required": [
    "$jsonschema",
    "IssueDate",
    "IssueTime",
    "SellerSupplierParty",
    "RequestForQuotationLine"
  ],
  "additionalProperties": false,
  "minProperties": 1,
  "title": "Request For Quotation. Details"
}
