{
  "$jsonschema": "urn:oasis:names:specification:ubl:schema:json:RequestForQuotation-2",
  "UBLVersionID": "2.0",
  "CustomizationID": "urn:oasis:names:specification:ubl:xpath:RequestForQuotation-2.0:sbs-1.0-draft",
  "ProfileID": "bpid:urn:oasis:names:draft:bpss:ubl-2-sbs-request-for-quotation-draft",
  "ID": "G867B",
  "CopyIndicator": false,
  "UUID": "8D076867-AE6D-439F-8281-5AAFC7F4E3B1",
  "IssueDate": "2005-06-19",
  "IssueTime": "11:32:26.0Z",
  "Note": "sample",
  "CatalogueDocumentReference": {
    "ID": "2005-9A",
    "IssueDate": "2005-11-03"
  },
  "OriginatorCustomerParty": {
    "Party": {
      "PartyName": {
        "Name": "The Terminus"
      },
      "PostalAddress": {
        "StreetName": "Avon Way",
        "BuildingName": "Thereabouts",
        "BuildingNumber": "56A",
        "CityName": "Bridgtow",
        "PostalZone": "ZZ99 1ZZ",
        "CountrySubentity": "Avon",
        "AddressLine": {
          "Line": "3rd Floor, Room 5"
        },
        "Country": {
          "IdentificationCode": "GB"
        }
      },
      "PartyTaxScheme": {
        "RegistrationName": "Bridgtow District Council",
        "CompanyID": "12356478",
        "ExemptionReason": "Local Authority",
        "TaxScheme": {
          "ID": "UK VAT",
          "TaxTypeCode": "VAT"
        }
      },
      "Contact": {
        "Name": "S Massiah",
        "Telephone": "0127 98876545",
        "Telefax": "0127 98876546",
        "ElectronicMail": "smassiah@the-email.co.uk"
      }
    }
  },
  "SellerSupplierParty": {
    "CustomerAssignedAccountID": "CO001",
    "Party": {
      "PartyName": {
        "Name": "Consortial"
      },
      "PostalAddress": {
        "StreetName": "Busy Street",
        "BuildingName": "Thereabouts",
        "BuildingNumber": "56A",
        "CityName": "Farthing",
        "PostalZone": "AA99 1BB",
        "CountrySubentity": "Heremouthshire",
        "AddressLine": {
          "Line": "The Roundabout"
        },
        "Country": {
          "IdentificationCode": "GB"
        }
      },
      "PartyTaxScheme": {
        "RegistrationName": "Farthing Purchasing Consortium",
        "CompanyID": "175 269 2355",
        "ExemptionReason": "N/A",
        "TaxScheme": {
          "ID": "VAT",
          "TaxTypeCode": "VAT"
        }
      },
      "Contact": {
        "Name": "Mrs Bouquet",
        "Telephone": "0158 1233714",
        "Telefax": "0158 1233856",
        "ElectronicMail": "bouquet@fpconsortial.co.uk"
      }
    }
  },
  "Delivery": {
    "DeliveryAddress": {
      "StreetName": "Avon Way",
      "BuildingName": "Thereabouts",
      "BuildingNumber": "56A",
      "CityName": "Bridgtow",
      "PostalZone": "ZZ99 1ZZ",
      "CountrySubentity": "Avon",
      "AddressLine": {
        "Line": "3rd Floor, Room 5"
      },
      "Country": {
        "IdentificationCode": "GB"
      }
    },
    "RequestedDeliveryPeriod": {
      "StartDate": "2005-06-29",
      "StartTime": "09:30:47.0Z",
      "EndDate": "2005-06-29",
      "EndTime": "09:30:47.0Z"
    }
  },
  "DeliveryTerms": {
    "SpecialTerms": "1% deduction for late delivery as per contract"
  },
  "DestinationCountry": {
    "IdentificationCode": "GB",
    "Name": "Great Britain"
  },
  "Contract": {
    "ContractDocumentReference": {
      "ID": "GHJ76849",
      "IssueDate": "2002-08-13"
    }
  },
  "RequestForQuotationLine": {
    "ID": "1",
    "Note": "sample",
    "LineItem": {
      "ID": "1",
      "Quantity": {
        "value": 100,
        "unitCode": "KGM"
      },
      "Item": {
        "Description": "Acme beeswax",
        "Name": "beeswax",
        "BuyersItemIdentification": {
          "ID": "6578489"
        },
        "SellersItemIdentification": {
          "ID": "17589683"
        }
      }
    }
  }
}
